Text,Environmental Negative,Environmental Neutral,Environmental Positive,Governance Negative,Governance Neutral,Governance Positive,Social Negative,Social Neutral,Social Positive,__index_level_0__
"In 2014, a federal court in New York found that the Ecuadorian judgment had been procured through fraud, bribery, and corruption, and was unenforceable in the United States.",0,0,0,1,0,0,0,0,0,483
"For example, 80% of residents living adjacent to Chevron’s Richmond, CA refinery are people of color, and they experience higher rates of cardiovascular disease, cancer, and asthma.",0,0,0,0,0,0,1,0,0,629
"This includes changes in portfolio, execution of projects identified through marginal abatement cost curves, and the policy, innovations, and offsets necessary to achieve net-zero.",0,0,1,0,0,1,0,0,0,359
Growing storms and the costs they bring our company are predicted to increase in frequency and intensity as global warming escalates.,1,0,0,0,0,0,0,0,0,148
"Chevron engages with stakeholders, including investors, civil society organizations, customers, and others, to inform its approach to its social and environmental responsibilities.",0,0,1,0,0,1,0,0,1,381
"Making recommendations to the board regarding corporate planning time frames, carbon reduction goals, and capital allocation strategies to redirect its business model and financial flows consistent with the Paris Agreement;",0,0,1,0,0,1,0,0,0,53
"While the Company rapidly expands its petrochemical assets in climate-impacted areas, investors seek improved disclosure to understand whether CPChem is adequately evaluating and mitigating public health risks associated with climate-related impacts and the dangerous chemicals it uses.",1,0,0,1,0,0,0,0,0,159
This diverse set of perspectives helps ensure that the Board challenges itself and management on the risks and opportunities related to climate change.,0,0,1,0,0,1,0,0,0,93
"Without disclosing confidential information and to the extent reasonably feasible, subject to the limitations of current direct measurement technology discussed above, we intend to include information referenced in the “Resolved” section of the Proposal in the Update, including how detection technologies have advanced, how they can inform emission reduction strategies, and the challenges and uncertainties of current direct measurement technology.",0,0,1,0,0,1,0,0,0,595
"Fenceline communities adjacent to Chevron’s Richmond, CA refinery have higher rates of cardiovascular disease, cancer, and asthma.",0,0,0,0,0,0,1,0,0,188
"Its emissions contribute to the climate crisis, which disparately impacts people of color and furthers systemic racism.",1,0,0,0,0,0,1,0,0,627
"On an annual basis, the full Board reviews long-term energy outlooks and leading indicators that could signify change.",0,0,0,0,0,1,0,0,0,75
Chevron has a disciplined process for lobbying activities that is transparent through existing disclosures.,0,0,0,0,0,1,0,0,0,111
"And Chevron does not disclose its payments to tax-exempt organizations that write and endorse model legislation, such as the American Legislative Exchange Council (ALEC).",0,0,0,1,0,0,0,0,0,412
"We believe that the Chevron Way, Chevron’s Human Rights Policy, its OEMS, ERM and other processes, and its Corporate Responsibility Report all appropriately address the underlying concerns and accomplish the essential objective of the stockholder proposal.",0,0,1,0,0,1,0,0,1,225
"Chevron also discloses on its website not just lobbying activities, but all political contributions.",0,0,0,0,0,1,0,0,0,434
The reports build on the Company’s voluntary report in 2017 and align with the reporting framework of the Financial Stability Board’s Task Force on Climate-related Financial Disclosures.,0,0,1,0,0,1,0,0,0,71
"Finally, plaintiffs’ recognition and enforcement proceedings outside Ecuador have failed in every jurisdiction in which they have been attempted to date, namely, Argentina, Brazil and Canada.",0,0,0,1,0,0,0,0,0,520
"RESOLVED: Shareholders request that Chevron’s Board of Directors issue an audited report to shareholders on whether and how a significant reduction in fossil fuel demand, envisioned in the IEA Net Zero 2050 scenario, would affect its financial position and underlying assumptions.",0,0,0,0,0,1,0,0,0,355
"Since the February 2021 military coup, the “Blood Money Campaign” by Myanmar and international civil society organizations has organized protests, consumer boycotts, and media pressure against companies, including Chevron, that provide financial support to the military junta.",0,0,0,1,0,0,1,0,0,607
"To further these efforts, Chevron holds membership in trade associations that provide expert perspectives on many issues.",0,0,0,0,0,1,0,0,0,425
Preparing for and holding a special meeting is time-consuming and expensive.,0,0,0,0,1,0,0,0,0,248
"Chevron, in partnership with Total, PTT, and Myanmar Oil and Gas Enterprise (MOGE), holds equity in one of the largest investment projects in Myanmar (Burma): the Yadana gas field and pipeline that has generated billions of dollars for the Myanmar military junta.",0,0,0,1,0,0,1,0,0,597
"Climate-related risks are a source of financial risk, and therefore limiting global warming is essential to risk management and responsible stewardship of the economy.",0,0,1,0,0,1,0,0,0,315
Chevron’s employees are required to complete political and lobbying compliance training.,0,0,0,0,0,1,0,0,0,442
Studies have found actual emissions to be between 50 and 90% higher than estimated emissions reported using the formula.,1,0,0,0,0,0,0,0,0,580
"The impacts to CPChem’s operations from Hurricane Harvey, however, indicate the company’s level of preparedness is insufficient.",1,0,0,1,0,0,0,0,0,158
"At Chevron’s last eight Annual Meetings, an average of 68 percent of votes cast opposed this stockholder proposal to reduce the threshold for calling special meetings to 10 percent.",0,0,0,1,0,0,0,0,0,246
"Given strong independent Board oversight of the CEO and management and the Company’s corporate governance practices, including an empowered and effective independent Lead Director, your Board does not believe that a fixed policy requiring an independent Chairman is in the best interests of stockholders.",0,0,0,0,0,1,0,0,0,490
"Chevron adheres to the highest ethical standards when engaging in lobbying and political activities, ensures that such activities align with corporate goals, and complies with all laws and regulations governing lobbying activities and disclosure.",0,0,0,0,0,1,0,0,0,133
"Chevron engages with stakeholders, including the proponent and other investors, civil society organizations, customers, and other third parties, on an ongoing basis to inform its approach to human rights issues.",0,0,0,0,0,0,0,0,1,223
Your Board expects Chevron’s management to continue vigorously defending against this fraud.,0,0,0,0,0,1,0,0,0,489
This site contains the details of the Company’s current and previous years’ contributions.,0,0,0,0,0,1,0,0,0,36
Your Board recommends a vote AGAINST this proposal.,0,0,0,1,0,0,0,0,0,197
Chevron’s Richmond facility is the city’s largest polluter and the company has spent millions of dollars to influence city politics and funding.,1,0,0,1,0,0,0,0,0,630
"Chevron’s climate risk reports have downplayed significant factors, such as potential competition",1,0,0,1,0,0,0,0,0,283
Chevron shares the view that managing climate change-related risks and energy transition opportunities is vital to delivering superior long-term value.,0,0,1,0,0,1,0,0,0,324
"Resolved, the stockholders of Chevron request the preparation of a report, updated annually, disclosing:",0,0,0,0,0,1,0,0,0,396
"In 2021, investors managing more than $5.35 trillion supported strong federal methane regulations.",0,0,1,0,0,1,0,0,0,583
"Methane is 86 times more potent than carbon dioxide over a 20-year period, meaning reducing emissions now can buy valuable time to address the climate crisis.",0,0,1,0,0,0,0,0,0,577
Major oil companies face unprecedented disruption to their business driven by global imperatives to limit global warming and competition from non-carbon-emitting technologies.,1,0,0,0,0,0,0,0,0,61
We believe that the Company could lead and thrive in the energy transition.,0,0,1,0,0,0,0,0,0,322
"Chevron’s management made significant missteps, including moving the case from New York to Ecuador.",0,0,0,1,0,0,0,0,0,500
The company has generally disclosed that physical climate-related risks may impact its business and that it has a risk management system to plan for resiliency.,0,1,0,0,0,1,0,0,0,157
"Shell, BP, Equinor, and Total have already adopted Scope 3 ambitions.",0,0,1,0,0,0,0,0,0,318
Of Chevron’s December 2019 announcement of a $10 billion+ write-down on the value of its assets.,0,0,0,1,0,0,0,0,0,281
We believe we have the right processes and governance to ensure that we make the right decisions about where and how we conduct our business.,0,0,0,0,0,1,0,0,0,617
"Although the proposal purports to relate to the Board’s leadership structure, its supporting statement shows that it is a vehicle to discuss the Ecuador litigation.",0,0,0,0,1,0,0,0,0,481
"This does not include state lobbying, where Chevron also lobbies but disclosure is uneven or absent.",0,0,0,0,1,0,0,0,0,405
These operations can become inundated and pose significant chemical release risks during extreme weather events.,1,0,0,0,0,0,0,0,0,145
"When Chevron acquired Texaco in 2001, it inherited significant legal, financial, and reputational liabilities that stemmed from pollution of the water and lands of communities in the Ecuadorian Amazon.",1,0,0,0,0,0,0,0,0,496
"Similarly, in a separate action, on August 30, 2018, an international tribunal administered by the Permanent Court of Arbitration in The Hague issued a unanimous award in favor of Chevron, finding that the Ecuadorian judgment was procured through fraud, bribery, and corruption, and that it was based exclusively on environmental claims settled and released by the Republic of Ecuador years earlier.",0,0,0,1,0,0,0,0,0,302
Our approach to human rights is consistent.,0,0,0,0,0,0,0,0,1,615
"Chevron has robust corporate governance practices to protect stockholder interests, including a declassified Board; proxy access; no supermajority voting provisions in its By-Laws and Certificate of Incorporation; and a strong independent Board structure.",0,0,0,0,0,1,0,0,0,514
"An independent 2021 report documented dozens of outstanding legal cases against Chevron for alleged environmental damage and human rights violations, noting that the company has only paid .006% of associated fines, court judgements, and settlements.",1,0,0,1,0,0,1,0,0,637
The 15 percent threshold helps avoid waste of Company and stockholder resources to address narrow or special interests.,0,0,0,0,0,1,0,0,0,509
Your Board expects Chevron’s management to continue acting in the best interests of the Company’s stockholders by vigorously defending the Company against this fraudulent action.,0,0,0,0,0,1,0,0,0,305
"Chevron uses long-term energy demand scenarios and a range of commodity prices to test its portfolio, guide investment strategies, and evaluate business risks to ensure it can deliver results under a range of potential futures.",0,0,0,0,0,1,0,0,0,360
"The Board’s Public Policy Committee monitors social, political, environmental, human rights, and public policy aspects of Chevron’s business and the communities in which it operates.",0,0,0,0,0,1,0,0,1,216
Chevron also engages through its various trade associations to ensure the development of well-designed climate policy.,0,0,1,0,0,1,0,0,0,128
"Under oath, Deputy Controller Rex Mitchell testified that such seizure of Company assets: “would cause significant, irreparable damage to Chevron’s business reputation and business relationships.”",0,0,0,0,1,0,0,0,0,238
"In spite of these risks, CPChem has accelerated its petrochemical activity in the Gulf Coast, investing heavily to expand in flood-prone areas of Texas.",1,0,0,1,0,0,0,0,0,156
"Chevron’s operations, discharges, and leaks disproportionately burden communities of color with pollution and human health risks.",1,0,0,0,0,0,1,0,0,628
"Given strong independent Board oversight of the CEO and management and the Company’s corporate governance practices, including an empowered and effective independent Lead Director, your Board does not believe that a fixed policy requiring an independent Chairman is in the best interests of stockholders.",0,0,0,0,0,1,0,0,0,308
"Information about Chevron’s political contributions, lobbying philosophy and oversight mechanisms.",0,0,0,0,0,1,0,0,0,29
"Supporting Statement: This Report might include:	
The extent and nature of community consultation to inform its analysis; and Assessment of impacts on environmental justice communities.",0,0,1,0,0,0,0,0,1,181
"A racial equity audit would help Chevron identify, prioritize, remedy, and avoid adverse impacts on people of color while reducing reputational risk and liabilities.",0,0,0,0,0,1,0,0,1,638
"2. Payments by Chevron used for (a) direct or indirect lobbying or (b) grassroots lobbying communications, in each case including the amount of the payment and the recipient.",0,0,0,0,1,0,0,0,0,398
Chevron believes it is essential to engage with policymakers and express the Company’s views on pending policy proposals through direct and indirect lobbying and participation in a diverse range of business and policy organizations that advocate for free markets and responsible energy legislation and regulations.,0,0,0,0,0,1,0,0,0,423
"Accordingly, your Board does not believe the report requested in the Proposal is necessary.",0,0,0,1,0,0,0,0,0,618
Chevron asserts that 'several international courts have determined the Ecuadorian Judgment to be fraudulent.',0,0,0,0,0,1,0,1,0,657
The Management Compensation Committee assesses and approves the incorporation of greenhouse gas–related performance measures into the scorecard that affects the compensation of management and most employees.,0,0,1,0,0,1,0,1,0,87
"Chevron has supported lobbying and trade associations that spread dis-information on climate science and policy, such as the American Legislative Exchange Council (“ALEC”) and the American Petroleum Institute (“API”).",1,0,0,1,0,0,0,0,0,464
"The Public Policy Committee (“PPC”) periodically assesses and advises on risks that may arise in connection with social, political, environmental and public policy aspects of Chevron’s business.",0,1,0,0,0,1,0,1,0,82
"more than 70% of listed companies, representing some of the world’s largest carbon-polluters, are not fully accounting for climate-related risks in their financial statements.",0,0,0,1,0,0,0,0,0,557
"The charter should explicitly require the committee to report to the full board on corporate strategy, above and beyond matters of legal compliance, assessing the company’s responses to climate related risks and opportunities, including the potential impacts of climate change on business, strategy, financial planning, and our company’s operating environment.",0,0,1,0,0,1,0,0,0,50
"The proposal relates to the activities of Chevron Phillips Chemical, a stand-alone enterprise in which Chevron owns a 50 percent interest.",0,0,0,0,1,0,0,0,0,166
The International Energy Agency’s (IEA) Net Zero Scenario describes an energy sector pathway to achieve net zero emissions.,0,0,1,0,0,0,0,0,0,555
"We, the shareholders, understand this support to be essential in protecting all our assets in the global economy from devastating climate change.",0,0,1,0,0,0,0,0,0,527
"Your Board believes that the vision and values of The Chevron Way, along with Chevron’s Business Conduct and Ethics Code, Human Rights Policy, OEMS, Enterprise Risk Management process, and Corporate Sustainability Report all provide robust information and documentation of Chevron’s approach and actions on racial equity and related issues.",0,0,1,0,0,1,0,0,1,650
"Your Board believes, and several prominent courts and international tribunals have now confirmed, that the Ecuador litigation is the product of fraud, extortion, and bribery.",0,0,0,1,0,0,0,0,0,261
Long-standing practices developed to manage these impacts are applied and extended to reflect possible effects of climate change and to ensure the ongoing resilience of the Company’s infrastructure.,0,0,1,0,0,0,0,0,0,163
Outside experts with sharply differing viewpoints enable your Board to consider the risks and opportunities arising from climate change.,0,0,0,0,0,1,0,0,0,77
"The United Nations Environment Programme Finance Initiative and Principles for Responsible Investment reports in the paper “Universal Ownership” that over 50 percent of companies’ earnings are at risk from climate costs, creating systemic risk for diversified investors.",1,0,0,0,1,0,0,0,0,376
"Guided by The Chevron Way, Chevron conducts its business responsibly, providing energy that is essential to human progress while benefiting the communities where the Company operates.",0,0,0,0,0,0,0,0,1,203
"Instead of negotiating an expedient, fair, and comprehensive settlement with the affected communities in Ecuador, Chevron pursued a costly legal strategy that lasted for more than two decades.",0,0,0,1,0,0,0,0,0,499
"Wherever we operate, we work to support local communities with basic human needs, including healthcare, education, and energy.",0,0,0,0,0,0,0,0,1,616
"For example, as a global energy company that negotiates concessions and leases with host-country governments around the world, we believe it is generally advantageous to the Company for the CEO to represent the Chevron Board as its Chairman in such dialogues.",0,0,0,0,0,1,0,0,0,472
"Engaging only with groups that already align with Chevron’s positions would undermine the Company’s ability to build and expand coalitions in support of its positions, including Chevron’s support for well-designed climate policy.",0,0,1,0,0,1,0,0,0,132
Your Board continues to believe that Chevron’s 15% threshold ensures that a reasonable number of stockholders consider a matter important enough to merit a special meeting.,0,0,0,0,0,1,0,0,0,668
Chevron has acknowledged the serious risk enforcement of the $9.5 billion judgment represents.,0,0,0,0,1,0,0,0,0,237
"In 2019, the Company updated its Human Rights Policy to more clearly state its continuing support for international human rights, including its commitment to respect the principles set out in the United Nations Universal Declaration of Human Rights, and in the International Labor Organization Declaration on Fundamental Principles and Rights at Work, and its commitment to adhere to the United Nations Guiding Principles on Business and Human Rights, the Voluntary Principles on Security and Human Rights, and the International Finance Corporation’s Performance Standards.",0,0,0,0,0,1,0,0,1,206
"In addition, Chevron exercises its right to participate in the political process by making contributions to candidates and entities supportive of the oil and gas industry and a reasonable regulatory environment.",0,0,0,0,0,1,0,0,0,121
"They also review policies, procedures, and expenditures for political activities.",0,0,0,0,0,1,0,0,0,441
"The Chevron Way explains our beliefs, vision, purpose, and values. It guides how we work and establishes a common understanding of our culture and aspirations. Diversity and inclusion are the first among our Chevron Way values.",0,0,0,0,0,0,0,0,1,644
"OE is a global framework to manage the health and safety of Chevron Phillips Chemical’s employees, contractors, facilities, and communities.",0,0,0,0,0,1,0,0,1,169
Chevron does not disclose its payments to trade associations nor amounts used for lobbying.,0,0,0,1,0,0,0,0,0,411
"The tribunal concluded that as a matter of international law, the judgment “should not be recognized or enforced by the courts of other States.”",0,0,0,1,0,0,0,0,0,519
Your Board believes that Chevron and its stockholders benefit from the resulting unity of leadership and companywide strategic alignment.,0,0,0,0,0,1,0,0,0,471
"As part of each Board meeting, the independent Directors meet in executive session without members of management present.",0,0,0,0,0,1,0,0,0,477
"Your Board believes it would not be a responsible use of Company resources to produce a further report to address a speculative scenario, as the Proposal requests.",0,0,0,1,0,0,0,0,0,575
"All three subsequently adjusted critical accounting assumptions, resulting in material impairments, and disclosed how climate change affected the adjustments.",1,0,0,0,0,1,0,0,0,353
"We, the shareholders, must protect our assets against devastating climate change, and we therefore support companies to substantially reduce greenhouse gas (GHG) emissions.",0,0,1,0,0,1,0,0,0,523
THEREFORE: Please vote FOR this common-sense governance enhancement.,0,0,0,0,0,1,0,0,0,287
"We believe that inadequate board oversight has led to management mishandling of a number of issues, which has increased both risk and cost to stockholders.",0,0,0,1,0,0,0,0,0,272
"The report should exclude confidential and proprietary information, as well as information relevant to any pending legal proceeding or threatened proceeding of which Chevron has notice.",0,0,0,0,1,0,0,0,0,622
"Of particular concern are the trade associations and other politically active organizations that speak for business but, unfortunately, too often present forceful obstacles to progress in addressing the climate crisis.",1,0,0,1,0,0,1,0,0,102
"Investors request the company assess, among other related issues at management and Board discretion: The adequacy of measures the company is employing to prevent public health impacts from associated chemical releases.",1,0,0,0,0,1,0,0,0,142
"Chevron lobbies ethically, constructively, and in a non-partisan manner.",0,0,0,0,0,1,0,0,0,424
"In doing so, Chevron works to ensure that such policy aligns with Chevron’s Climate Principles of encouraging global engagement, striking a balanced and measured approach, supporting research and innovation, and providing transparency for consumers.",0,0,1,0,0,1,0,0,0,129
The 15 percent threshold helps avoid waste of Company and stockholder resources to address narrow or special interests.,0,0,0,0,0,1,0,0,0,249
"Yet, the $9.5 billion Ecuadorian judgment against Chevron has been thoroughly discredited by every court and tribunal outside Ecuador that has reviewed the matter.",0,0,0,1,0,0,0,0,0,482
"While Chevron has a Human Rights Policy and Operational Excellence Management System, investors are unable to assess the effectiveness of these systems in identifying risks, ensuring meaningful stakeholder engagement, reducing negative impacts on communities and the environment, and provision of remedy.",0,0,0,1,0,0,1,0,0,194
"Finally, plaintiffs’ recognition and enforcement proceedings outside Ecuador have failed in every jurisdiction in which they have been attempted to date, including Argentina, Brazil and Canada.",0,0,0,0,0,1,0,0,0,267
Preparing for and holding a special meeting is time-consuming and expensive.,0,0,0,0,1,0,0,0,0,669
"In the US, three of these climate resolutions passed with a historic majority.",0,0,1,0,0,0,0,0,0,533
Chevron’s actions in support of racial equity are described in detail in numerous publications:,0,0,0,0,0,1,0,0,1,643
"We could reduce our GHG emissions by changing our portfolio and selling our emissions-producing assets, but that would not serve our stockholders, who benefit from our strong asset base.",0,0,0,0,0,1,0,0,0,541
All of Chevron’s political and lobbying activities are subject to thorough review and oversight.,0,0,0,0,0,1,0,0,0,438
"Discharge or leaks from Chevron’s operations may impact human health and the environment, and affected communities may not be adequately consulted or informed of risks.",1,0,0,0,0,0,1,0,0,186
"Currently, the Board has appointed Michael K. Wirth to serve as CEO and as Chairman of the Board.",0,0,0,0,0,1,0,0,0,470
"Your Board agrees with Proponents that Chevron must protect its free speech rights and rights to engage on issues important to its business, and in which it has expertise.",0,0,0,0,0,1,0,0,0,10
"Similarly, in a separate action, on August 30, 2018, an international tribunal administered by the Permanent Court of Arbitration in The Hague issued a unanimous award in favor of Chevron, finding that the Ecuadorian judgment was procured through fraud, bribery, and corruption, and that it was based exclusively on environmental claims settled and released by the Republic of Ecuador years earlier.",0,0,0,0,0,1,0,0,0,265
"In 2010, stockholders representing approximately 80 percent of Chevron’s common stock outstanding approved an amendment to Chevron’s By-Laws that permits stockholders owning 15 percent of Chevron’s outstanding common stock to call for a special meeting.",0,0,0,0,0,1,0,0,0,245
We would not be fulfilling our fiduciary duty if we were to base our decisions on what a particular constituency believes the appropriate exercise of these fundamental rights to be.,0,0,0,0,0,1,0,0,0,136
The report shall be presented to the Public Policy Committee and posted on Chevron’s website.,0,0,0,0,1,0,0,0,0,403
Chevron does this with the highest ethical standards and in compliance with all laws governing lobbying activities and disclosure.,0,0,0,0,0,1,0,0,0,422
"If the Board determines that a Chair who was independent when selected is no longer independent, within a reasonable period it shall select a new Chair who satisfies the requirements of this policy. Compliance with this policy can be waived if no independent director is available and willing to serve as Chair.",0,0,0,0,0,1,0,0,0,271
THEREFORE: Vote FOR this common-sense governance enhancement that would improve shareholder communication and protect shareholder value.,0,0,0,0,0,1,0,0,0,242
"Under the By-Laws, a special meeting cannot be called:",0,0,0,0,1,0,0,0,0,670
