Text,Environmental Negative,Environmental Neutral,Environmental Positive,Governance Negative,Governance Neutral,Governance Positive,Social Negative,Social Neutral,Social Positive,__index_level_0__
"The Audit Committee analyzes potential financial risk exposures as part of Chevron’s enterprise risk management program, including potential financial risks associated with climate change.",0,1,0,0,0,1,0,1,0,85
"In contrast, the audit reports for other high GHG-emitting companies clearly discussed this connection.",0,0,0,0,0,1,0,0,0,348
"Stockholders can be assured that their right to be apprised of and vote on significant matters is protected not only by their existing right to call for special meetings and participate in Chevron’s Annual Meetings, but also by state law and other regulations.",0,0,0,0,0,1,0,0,0,512
"Two hundred institutional investors managing $6.5 trillion recently wrote to Chevron, seeking information on how the company is managing this critical governance issue.",0,0,0,0,0,1,0,0,0,106
"Over 60% of publicly reported abuses from Chevron’s operations impacted Indigenous Peoples, including violation of land rights, allegations of genocide, violence against Indigenous women, and widespread environmental damage and human rights violations in Ecuador, Indonesia, Nigeria, and the United States.",1,0,0,0,0,0,1,0,0,635
"The Company leverages its capabilities, assets, and expertise to focus on these three action areas that aim to deliver measurable progress: (1) lower carbon intensity cost efficiently, (2) increase renewables and offsets in support of our own business, and (3) invest in low-carbon technologies to enable commercial solutions.",0,0,1,0,0,1,0,0,0,330
"Insufficient information is presently available to help investors understand whether Chevron works to ensure that its lobbying activities, directly, in the company’s name, and indirectly, through trade associations, align with the Paris Agreement’s goals, and whether Chevron takes any action to address any misalignments it has found.",0,0,0,1,0,0,0,0,0,107
"Rather, we report and disclose in accordance with U.S. GAAP and are audited in accordance with the standards of the Public Company Accounting Oversight Board.",0,0,0,0,0,1,0,0,0,572
"Chevron has developed the Portfolio Carbon Intensity (“PCI”) methodology, which we believe addresses the interests of stakeholders wanting comparable metrics that address Scopes 1, 2 and 3 emissions.",0,0,1,0,0,0,0,0,0,544
"Chevron adheres to the highest ethical standards when engaging in lobbying and political activities, ensures that such activities align with corporate goals, and complies with all laws and regulations governing lobbying activities and disclosure.",0,0,0,0,0,1,0,0,0,23
"Partnerships in health, education, and economic development advance progress and strengthen communities.",0,0,0,0,0,0,0,0,1,384
"Deputy Controller Rex Mitchell testified, under oath, that such seizures of Company assets “would cause significant, irreparable damage to Chevron’s business reputation and business relationships.”",0,0,0,1,0,0,0,0,0,277
These reports disclose total expenditures related to lobbying and issues lobbied.,0,0,0,0,0,1,0,0,0,34
"The role of the Lead Director is highly empowered, as described in the “Independent Lead Director” section of this Proxy Statement on page 22.",0,0,0,0,0,1,0,0,0,475
"The Board’s Public Policy and Sustainability Committee monitors the social, political, environmental, human rights, and public policy aspects of Chevron’s business and the communities in which it operates.",0,0,1,0,0,1,0,0,1,393
"Chevron is also listed on the New York Stock Exchange (“NYSE”), and the NYSE requires, among other things, that listed companies obtain stockholder approval for equity compensation plans and significant issuances of equity securities to related parties and for when such issuances represent more than 20 percent of an issuer’s voting power.",0,0,0,0,0,1,0,0,0,257
"Chevron does so by engaging with policymakers and expressing its views on pending policy proposals, by engaging in direct and indirect lobbying, and by participating in a diverse range of business and policy organizations that advocate positions supporting free markets and responsible energy legislation and regulations.",0,1,0,0,0,1,0,0,0,19
"The Company’s lobbying activities in the United States are strictly regulated by federal, state, and local lobbying laws.",0,0,0,0,0,1,0,0,0,26
BP: how climate change and a global energy transition impacted the capitalization of exploration and appraisal costs and risks that oil and gas price assumptions could lead to financial misstatements.,1,0,0,0,0,1,0,0,0,349
"1. Company policy and procedures governing lobbying, both direct and indirect, and grassroots lobbying communications.",0,0,0,0,1,0,0,0,0,397
"In addition, the Company discloses a full list of trade associations with annual dues of more than $100,000 wherein a portion of the dues may be used for lobbying.",0,0,0,0,0,1,0,0,0,13
"The proposal purports to relate to special meetings, its supporting statement shows that it is a vehicle to discuss the Ecuador litigation and related actions against Chevron.",0,0,0,1,0,0,0,0,0,515
"This approach ensures Chevron is accountable for all Upstream GHG emissions, irrespective of who is the operator, unlike many others who account only for emissions from a subset of assets in which they have invested.",0,0,1,0,0,0,0,0,0,327
"However, the proponent’s supporting statement contains references to legal actions and allegations of impacts from the Company’s operations that are inaccurate, misleading and, in some cases, contrary to final judgments.",0,0,0,1,0,0,1,0,0,201
Whereas: Board oversight of climate change strategy and planning is essential to address the existential threat of climate change to the fossil fuel industry and our Company.,0,0,1,0,0,1,0,0,0,59
Chevron has a strong corporate governance structure to enable the Company to meet the rising expectations of stakeholders.,0,0,0,0,0,1,0,0,0,390
Your Board shares the proponent’s stated concern for human rights.,0,0,0,0,0,1,0,0,1,200
"Chevron does not agree with all of the positions of every industry, trade or policy organization in which it participates.",0,0,0,0,1,0,0,0,0,21
"As another example, Chevron recently updated the Chevron Engineering Standard for Metocean Design and Operating Conditions based on the assessment of future potential impacts to Chevron’s marine facilities, such as potential changes in storm intensity, changes to sea level and changing water currents.",0,0,1,0,0,0,0,0,0,165
"Given Chevron’s current disclosures and robust strategy, planning, and risk management processes, your Board believes that the requested report is unnecessary.",0,0,0,0,0,1,0,0,0,371
This information is confidential and competitively sensitive.,0,0,0,0,1,0,0,0,0,570
"To allow maximum flexibility, nothing in this resolution shall serve to micromanage the Company by seeking to impose methods for implementing complex policies in place of the ongoing judgement of management as overseen by its board of directors.",0,0,0,0,1,0,0,0,0,311
"Chevron does not agree with all positions of every industry, trade, or policy organization in which it participates.",0,0,0,0,1,0,0,0,0,427
For two decades the affected communities brought suit against Texaco (and subsequently Chevron).,1,0,0,0,0,0,0,0,0,497
"Consistent with the timing of the global stock-takes under the Paris Agreement, Chevron has set metrics for 2023 and 2028 and intends to do so every five years thereafter.",0,0,1,0,0,1,0,0,0,328
Outside experts have met with your full Board to share their perspectives on climate change and the energy transition.,0,0,0,0,0,1,0,0,0,76
Your Board encourages you to review the reports and other materials described above.,0,0,0,0,0,1,0,0,0,448
3. Chevron’s membership and payments to any tax-exempt organization that writes and/or endorses model legislation.,0,0,0,0,1,0,0,0,0,4
Investors seek additional information from Chevron to understand the impact of climate-related factors on its business model and current financial reporting.,0,0,0,0,0,1,0,0,0,562
"It is essential, therefore, for Chevron to exercise its fundamental right and responsibility to participate in the public policymaking process.",0,0,0,0,0,1,0,0,0,18
"Our commitment to human rights is reflected throughout our business and in how we conduct ourselves, including in our Human Rights Policy, our Operational Excellence Management System, and our Business Conduct and Ethics Code, all of which are on our website.",0,0,0,0,0,1,0,0,1,613
Chevron agrees that transparency and accountability are important aspects of corporate political activity.,0,0,0,0,0,1,0,0,0,429
The U.S. Holocaust Memorial Museum has reported that the Rohingya remain “at grave risk of additional mass atrocities and even genocide.”,0,0,0,0,0,0,1,0,0,604
"An independent Chair would improve oversight of management, and the attention paid to long-range risks such as those noted above.",0,0,0,0,0,1,0,0,0,286
"Chevron’s Corporate Audit department, which performs the internal audit function at Chevron, conducted a non-rated assurance review of the NZE 2050 scenario analysis, and determined that the analysis was conducted in accordance with established internal process and emerging external guidance.",0,0,0,0,0,1,0,0,0,568
"We regularly analyze alternative scenarios to stress-test our portfolio, and we integrate those learnings to help us remain competitive and resilient in any environment.",0,0,0,0,0,1,0,0,0,569
"The independent oversight of Chevron’s Board leadership is further supported by strong Board refreshment, multidimensional diversity among its Directors, and regular rotation of Committee chairpersons and of the Lead Director, all of which ensures that new perspectives are brought to the selection of Chevron’s Chairman and to other critical Board decisions.",0,0,0,0,0,1,0,0,0,480
"In a separate action, in 2018, an international tribunal administered by the Permanent Court of Arbitration in The Hague issued a unanimous award in favor of Chevron, finding that the Ecuadorian judgment was procured through fraud, bribery, and corruption, and that it was based exclusively on environmental claims settled and released by the Republic of Ecuador years earlier.",1,0,0,1,0,0,0,0,0,518
"Given the time and cost associated with special meetings, your Board believes that these are appropriate and reasonable limitations.",0,0,0,0,0,1,0,0,0,673
"A failure to adequately plan for a low carbon transition, including climate change policy, competition from renewables, peak oil demand, and unburnable fossil fuel reserves, may place investor capital at substantial risk.",1,0,0,1,0,0,0,0,0,65
"Chevron does not agree with all of the positions of every industry, trade or policy organization in which it participates.",0,0,0,0,1,0,0,0,0,130
"Recent reports show that greenhouse gas emissions throughout the petrochemical and plastic supply chain contribute significantly to climate change, thereby exacerbating the threat of physical risks such as storms.",1,0,0,0,0,0,0,0,0,149
"In certain basins, studies have found emissions to be more than 10 times higher than industry disclosed figures.",1,0,0,0,0,0,0,0,0,581
"Chevron belongs to the Business Roundtable (BRT), Chamber of Commerce and National Association of Manufacturers (NAM), which spent $127,448,048 on lobbying for 2018.",0,0,0,0,1,0,0,0,0,409
Chevron’s most recent annual Corporate Political Contributions report and the Chevron Employee Political Action Committee (“CEPAC”) contributions report.,0,0,0,0,0,1,0,0,0,30
A special meeting cannot be called (i) if the Board has already called or will call an Annual Meeting of stockholders for the same purpose specified in the special meeting request or (ii) if an annual or special meeting was held not more than 12 months before the request for a special meeting was received and included the purpose specified in the special meeting request.,0,0,0,0,1,0,0,0,0,252
"Expectations continue to rise, and responding to these expectations is a responsibility Chevron takes seriously.",0,0,1,0,0,1,0,0,1,382
"Your Board does recognize the importance of independent oversight of the CEO and management, and it has instituted structures and practices to enhance such oversight.",0,0,0,0,0,1,0,0,0,473
"With this oversight framework, our strategic plans reflect management’s best assessment of the longer-term outlook on supply, demand and commodity prices and its judgment in deploying the Company’s strategy in that environment.",0,0,0,0,0,1,0,0,0,573
"The independent oversight of Chevron’s Board leadership is further supported by strong Board refreshment, multidimensional diversity among its Directors, and regular rotation of Committee chairpersons and of the Lead Director, all of which ensures that new perspectives are brought to the selection of Chevron’s Chairman and to other critical Board decisions.",0,0,0,0,0,1,0,0,0,295
Your Board expects Chevron’s management to continue acting in the best interests of the Company’s stockholders by vigorously defending the Company against this fraudulent action.,0,0,0,0,0,1,0,0,0,268
global and U.S. accounting and auditing standard-setters reiterated that material climate-related risks should be accounted for in company financial statements and audits.,0,0,0,0,0,1,0,0,0,552
"In addition to a lower threshold, the proposal would permit a special meeting without appropriate and reasonable limitations.",0,0,0,1,0,0,0,0,0,250
1. Supporting a price on carbon through well-designed policies;,0,0,1,0,0,1,0,0,0,333
"Deputy Controller Rex Mitchell testified, under oath, that such seizures of Company assets “would cause significant, irreparable damage to Chevron’s business reputation and business relationships.”",0,0,0,0,0,0,1,0,0,458
"When Chevron acquired Texaco in 2001, it inherited significant legal, financial, and reputational liabilities that stemmed from pollution of the water and lands of communities in the Ecuadorian Amazon.",1,0,0,0,0,0,1,0,0,231
"These concerns reflect a converging consensus by policymakers, investors, and companies on growing climate risk, the need to limit global temperature increase to 1.5° C (net zero global greenhouse gas (GHG) emissions by 2050), and the impact of such actions to companies.",0,0,1,0,0,0,0,0,0,554
Trade associations also provide a venue for Chevron to engage with other companies and industry experts.,0,0,0,0,0,1,0,0,0,426
"Flooding from Hurricane Harvey in 2017 resulted in CPChem plant shut downs and the release of unpermitted, unsafe levels of pollutants.",1,0,0,0,0,0,0,0,0,146
"Also, Chevron is listed on the New York Stock Exchange, which requires, among other things, that listed companies obtain stockholder approval for equity compensation plans and significant issuances of equity securities to related parties and for when such issuances represent more than 20% of an issuer’s voting power.",0,0,0,0,0,1,0,0,0,676
"Currently, the Board has determined to appoint Michael K. Wirth to serve as CEO and as Chairman of the Board.",0,0,0,0,1,0,0,0,0,291
"Although the proposal purports to relate to the Board’s leadership structure, the supporting statement makes clear that the proposal is fundamentally a vehicle to discuss the Ecuador litigation and related actions against Chevron.",0,0,0,0,1,0,0,0,0,297
Chevron agrees that transparency and accountability are important aspects of corporate political activity.,0,0,0,0,0,1,0,0,0,24
"Your Board recommends a vote AGAINST this proposal because your Board believes that stockholder interests are best served when Directors have the flexibility to determine the best person to serve as Chairman, recognizing that no single leadership model is appropriate in all circumstances.",0,0,0,0,1,0,0,0,0,288
The OEMS includes assurance and audit programs to assess compliance with internal and external requirements.,0,0,0,0,0,1,0,0,0,213
Shareholders urgently need a reasonable 10% threshold to call special meetings.,0,0,0,0,0,1,0,0,0,241
Their experience comes from the academic and business sectors.,0,0,0,0,1,0,0,0,0,92
"Chevron’s climate risk reports have downplayed significant factors, such as potential competition from low-carbon energy technologies.",1,0,0,1,0,0,0,0,0,463
"Proponents recommend that in issuing the report, the company take account of information on: Assumptions, costs, estimates, and valuations that may be materially impacted; and The potential for widespread adoption of net-zero goals by governments and peers.",0,0,0,0,1,0,0,0,0,357
"Therefore, your Board recommends that you vote for this proposal.",0,0,0,0,0,1,0,0,0,596
Chevron stated that Hurricane Harvey is the primary reason for lower earnings of $70 million from CPChem in 2017.,1,0,0,0,0,1,0,0,0,151
"This is embedded in the Company’s culture, policies and processes, which are designed to ensure its business is conducted in a socially and environmentally responsible manner.",0,0,1,0,0,1,0,0,1,199
"Together, Total and Chevron have a majority controlling interest in Yadana project.",0,0,0,0,1,0,0,0,0,598
The policies of energy companies—the largest greenhouse gas (GHG) emitters—are crucial to confronting the climate crisis.,0,0,1,0,0,0,0,0,0,525
Such an approach would put the Company at a competitive disadvantage and would unnecessarily limit the benefits associated with Chevron’s participation in the public policymaking process through engagement with a broad array of stakeholders.,0,0,0,0,0,1,0,0,0,137
The associations on this list represent 96 percent of the Company’s annual trade association expenditures.,0,0,0,0,0,1,0,0,0,14
See also “Board Leadership Structure” on page 21.,0,0,0,0,1,0,0,0,0,476
"The Company’s governance of climate change–related issues is described in its 2018 Climate Change Resilience Report and the February 2019 supplement, which are on Chevron’s website.",0,0,1,0,0,1,0,0,0,70
"As part of this, and as you will see from our support of Proxy Item 7, Chevron is committed to detecting and mitigating methane emissions.",0,0,1,0,0,1,0,0,0,549
"The Company’s strategies, such as those outlined above, are intended to drive higher returns and lower carbon.",0,0,1,0,0,1,0,0,0,343
The Nominating and Governance Committee identifies and recommends prospective Directors with the goal of maintaining a Board composition appropriate to overseeing the wide-ranging risks affecting Chevron.,0,1,0,0,0,1,0,1,0,88
For two decades the affected communities brought suit against Texaco (and subsequently Chevron).,0,0,0,0,0,0,1,0,0,232
"Chevron’s Human Rights Policy, available on its website, reinforces Chevron’s commitment to respecting human rights.",0,0,0,0,0,1,0,0,1,204
"Resolved: Shareholders request that the Board of Directors commission and publicly disclose the findings of an independent racial equity audit, analyzing if, and how, Chevron’s policies and practices discriminate against or disparately impact communities of color.",0,0,0,0,0,1,1,0,0,619
"The National Unity Government of Myanmar, made up of elected officials and civil society leaders, has called on the oil companies operating in Myanmar to withhold from the military junta and place in escrow any payments due to the Myanmar government.",0,0,0,0,0,1,0,0,1,606
"Neither the arbitration held in the Netherlands under a bilateral investment treaty, nor any court since has ruled on Chevron’s assertion that the Ecuadorian Judgment resulted from fraud.",0,0,0,0,1,0,0,0,0,659
"At Chevron’s last eight Annual Meetings, an average of 73 percent of votes cast opposed this proposal.",0,0,0,0,1,0,0,0,0,9
Chevron is committed to an honest conversation about the energy transition.,0,0,0,0,0,1,0,0,0,540
"Stockholders can be assured that their right to be apprised of and vote on significant matters is protected not only by their existing right to call for special meetings and participate in Chevron’s Annual Meeting, but also by state law and other regulations.",0,0,0,0,0,1,0,0,0,674
"Companies that do not manage methane emissions jeopardize other industry decarbonization efforts, and risk their reputation and license to operate, as investors, regulators and civil society are setting expectations to address this issue.",0,0,1,0,0,1,0,0,1,582
Each governing jurisdiction determines its own regulations regarding lobbying compliance and also establishes the policies and guidelines associated with reporting and disclosure.,0,0,0,0,0,1,0,0,0,27
"Therefore, your Board recommends that you vote AGAINST this proposal.",0,0,0,1,0,0,0,0,0,95
"Chevron’s processes for managing enterprise risk are already subject to robust Board oversight, as described in the Climate Change Resilience Report available on Chevron’s website.",0,0,1,0,0,1,0,0,0,307
Chevron analyzes how various factors may combine to create alternative scenarios to stress-test its portfolio and integrate learnings into its decision making to remain competitive and resilient under multiple scenarios.,0,0,0,0,0,1,0,0,0,361
CEO/board chair Michael Wirth’s statements regarding the Ecuador Judgment were challenged in a House Oversight Committee where a Member observed that Wirth told shareholders “[there] was no scientific evidence of contamination.”,0,0,0,0,0,0,1,0,0,661
"On August 8, 2016, the U.S. Court of Appeals for the Second Circuit unanimously affirmed the SDNY’s findings, noting that “the record in the present case reveals a parade of corrupt actions…, including coercion, fraud and bribery, culminating in the promise to [the] Judge of $500,000 from a judgment in favor of the [Ecuadorian plaintiffs].”",0,0,0,1,0,0,0,0,0,300
"As of December 2020, Chevron Corporation had neither committed to net-zero emissions by 2050 across its value chain, nor disclosed how its financial assumptions would change from doing so.",1,0,0,1,0,0,0,0,0,347
"In an unprecedented move, Chevron harassed and subpoenaed stockholders who questioned the advisability of the Company’s legal strategy.",0,0,0,1,0,0,0,0,0,236
Chevron already discloses extensive information about its lobbying activities as well as its political contributions.,0,0,0,0,0,1,0,0,0,112
"Additionally, Chevron faces scrutiny for financing United States politicians with failing civil rights grades issued by the NAACP.",0,0,0,1,0,0,1,0,0,633
"At its Investor Day on March 9, 2021, Chevron outlined the steps it is taking, and the challenges it faces, in working toward a net-zero future.",0,0,1,0,0,1,0,0,0,358
And Chevron’s ALEC membership has drawn scrutiny.,0,0,0,1,0,0,0,0,0,415
"Your Board does recognize the importance of independent oversight of the CEO and management, and it has instituted structures and practices to enhance such oversight",0,0,0,0,0,1,0,0,0,294
"Its operations may have discriminatory impact, with disparate harm on communities of color and fenceline communities.",0,0,0,0,0,0,1,0,0,184
"A fixed policy requiring a separation of the roles of Chairman and CEO is also unwarranted because of Chevron’s many other strong corporate governance practices, including the following: the annual election of all Directors; a majority vote requirement in uncontested elections of Directors; an overwhelming majority of independent Directors; proxy access; independent Director access to employees; and publicly available Corporate Governance Guidelines.",0,0,0,0,0,1,0,0,0,479
"Chevron’s analysis includes scenarios forecasting emissions pathways that keep global warming to well below 2o C above pre-industrial levels, as well as scenarios forecasting net-zero emissions by 2050.",0,0,1,0,0,0,0,0,0,363
"The Board also has access to Chevron’s internal subject-matter experts and regularly receives briefings on such climate change–related issues as policies and regulations, technology, and adaptation.",0,0,0,0,0,1,0,0,0,78
"Given the time and cost associated with special meetings, your Board believes that these are appropriate and reasonable limitations.",0,0,0,0,0,1,0,0,0,253
That report discusses how our portfolio would fare from a financial viability perspective and also the changes we would need to make under the NZE 2050 assumptions.,0,0,0,0,0,1,0,0,0,567
The Public Policy and Sustainability Committee of the Board of Directors annually reviews Chevron’s lobbying activities and budget to assess the value of these activities and ensure alignment with Chevron’s positions and interests.,0,0,0,0,0,1,0,0,0,439
We commend Chevron for now disclosing its largest trade associations.,0,0,0,0,0,1,0,0,0,408
"Your Board believes that Chevron operates in a responsible and sustainable manner, furthering the interests of many stakeholders, which directly contributes to the long-term health and growth of our business. Converting to a public benefit corporation is unnecessary and not an appropriate way to ensure the Company meets its social and environmental responsibilities.",0,0,0,1,0,0,0,0,1,394
"Chevron Phillips Chemical strives to conduct business in a safe, secure, injury-free, and environmentally responsible manner, described in its Operation Excellence (“OE”) Policy, which is on the Chevron Phillips Chemical website.",0,0,1,0,0,1,0,0,1,168
Compliance with this policy can be waived if no independent director is available and willing to serve as Chair.,0,0,0,0,1,0,0,0,0,452
"When the CEO is elected Chairman, the independent Directors annually elect a Lead Director from among themselves.",0,0,0,0,0,1,0,0,0,474
"Successfully achieving these emissions intensity reduction metrics is linked to most Chevron employees’ variable compensation, as reflected in the Chevron Incentive Plan (CIP) scorecard.",0,0,1,0,0,1,0,0,1,329
"The ESHIA process is guided by four key environmental principles: include the environment in decision making, reduce the environmental footprint, operate responsibly, and steward the Company’s sites.",0,0,1,0,0,1,0,0,0,212
